drop database if exists mylite_mtr_foreign_keys;
create database mylite_mtr_foreign_keys;
use mylite_mtr_foreign_keys;
set session sql_mode='NO_ENGINE_SUBSTITUTION';
set session default_storage_engine=MYLITE;
set session enforce_storage_engine=MYLITE;
set session use_stat_tables=NEVER;
create table parents (
id int not null primary key,
title varchar(32) not null unique
) engine=InnoDB;
create table children (
id int not null primary key,
parent_id int not null,
title varchar(32) not null,
key parent_idx (parent_id),
constraint child_parent_fk foreign key (parent_id) references parents (id)
) engine=InnoDB;
show create table children;
Table	Create Table
children	CREATE TABLE `children` (
  `id` int(11) NOT NULL,
  `parent_id` int(11) NOT NULL,
  `title` varchar(32) NOT NULL,
  PRIMARY KEY (`id`),
  KEY `parent_idx` (`parent_id`),
  CONSTRAINT `child_parent_fk` FOREIGN KEY (`parent_id`) REFERENCES `parents` (`id`)
) ENGINE=InnoDB DEFAULT CHARSET=utf8mb4 COLLATE=utf8mb4_uca1400_ai_ci
insert into parents values (1, 'parent');
insert into children values (1, 1, 'child');
insert into children values (2, 2, 'orphan');
ERROR 23000: Cannot add or update a child row: a foreign key constraint fails
delete from parents where id = 1;
ERROR 23000: Cannot delete or update a parent row: a foreign key constraint fails
select p.id as parent_id, c.id as child_id
from parents p join children c on c.parent_id = p.id
order by p.id, c.id;
parent_id	child_id
1	1
alter table children drop foreign key child_parent_fk;
delete from parents where id = 1;
select count(*) as parent_rows from parents;
parent_rows
0
select id, parent_id, title from children order by id;
id	parent_id	title
1	1	child
drop database mylite_mtr_foreign_keys;
